{
  "schema_version": "1.0.0",
  "module_id": "EMT-02",
  "tier": "emt",
  "questions": [
    {
      "schema_version": "1.0.0",
      "id": "EMT-02-01-01-Q001",
      "concept_id": "EMT-02-01-01",
      "style": "recall",
      "stem": "Which structure marks the boundary between the upper and lower airway?",
      "options": [
        {
          "text": "The epiglottis",
          "rationale": "The epiglottis is part of the upper airway; it guards the entrance to the larynx but is not the dividing line."
        },
        {
          "text": "The larynx",
          "rationale": "Correct. The upper airway ends at the larynx; the lower airway begins with the trachea just below it."
        },
        {
          "text": "The carina",
          "rationale": "The carina is well into the lower airway, where the trachea splits into the two mainstem bronchi."
        },
        {
          "text": "The oropharynx",
          "rationale": "The oropharynx is the middle section of the pharynx, entirely within the upper airway."
        }
      ],
      "correct_index": 1,
      "difficulty": 1,
      "domain": "AIR",
      "verify": true,
      "verify_notes": "Confirm boundary definition in AAOS 12e."
    },
    {
      "schema_version": "1.0.0",
      "id": "EMT-02-01-01-Q002",
      "concept_id": "EMT-02-01-01",
      "style": "recall",
      "stem": "The function of the epiglottis is to:",
      "options": [
        {
          "text": "Produce sound for speech",
          "rationale": "Sound is produced by the vocal cords within the larynx, not the epiglottis."
        },
        {
          "text": "Cover the opening of the trachea during swallowing",
          "rationale": "Correct. The leaf-shaped epiglottis folds over the glottic opening so food and liquid go to the esophagus rather than the lungs."
        },
        {
          "text": "Warm and humidify inhaled air",
          "rationale": "Warming and humidifying happen in the nasal passages."
        },
        {
          "text": "Exchange oxygen and carbon dioxide",
          "rationale": "Gas exchange occurs only in the alveoli."
        }
      ],
      "correct_index": 1,
      "difficulty": 1,
      "domain": "AIR",
      "verify": true,
      "verify_notes": "Confirm in AAOS 12e."
    },
    {
      "schema_version": "1.0.0",
      "id": "EMT-02-01-01-Q003",
      "concept_id": "EMT-02-01-01",
      "style": "application",
      "stem": "The most common cause of airway obstruction in an unresponsive patient lying supine is:",
      "options": [
        {
          "text": "A foreign body",
          "rationale": "Foreign bodies cause obstruction, but far less often than the tongue in an unresponsive patient."
        },
        {
          "text": "The tongue",
          "rationale": "Correct. Loss of muscle tone lets the tongue fall back against the posterior pharynx. Positioning maneuvers correct this."
        },
        {
          "text": "Swelling of the epiglottis",
          "rationale": "Epiglottitis is a real but uncommon cause, mostly in specific infections."
        },
        {
          "text": "Collapse of the trachea",
          "rationale": "The adult trachea is supported by cartilage rings and does not collapse under normal conditions."
        }
      ],
      "correct_index": 1,
      "difficulty": 1,
      "domain": "AIR",
      "verify": true,
      "verify_notes": "Confirm in AAOS 12e."
    },
    {
      "schema_version": "1.0.0",
      "id": "EMT-02-01-01-Q004",
      "concept_id": "EMT-02-01-01",
      "style": "recall",
      "stem": "Gas exchange between the air and the blood takes place in the:",
      "options": [
        {
          "text": "Bronchi",
          "rationale": "The bronchi are conducting airways; no gas exchange occurs there."
        },
        {
          "text": "Trachea",
          "rationale": "The trachea only conducts air to and from the lungs."
        },
        {
          "text": "Alveoli",
          "rationale": "Correct. Oxygen and carbon dioxide diffuse across the thin alveolar-capillary membrane."
        },
        {
          "text": "Larynx",
          "rationale": "The larynx houses the vocal cords and marks the top of the lower airway; it does not exchange gas."
        }
      ],
      "correct_index": 2,
      "difficulty": 1,
      "domain": "AIR",
      "verify": true,
      "verify_notes": "Confirm in AAOS 12e."
    },
    {
      "schema_version": "1.0.0",
      "id": "EMT-02-01-02-Q001",
      "concept_id": "EMT-02-01-02",
      "style": "application",
      "stem": "When positioning an infant's airway, the EMT places padding under the shoulders because:",
      "options": [
        {
          "text": "Infants have a proportionally large occiput that flexes the neck when supine",
          "rationale": "Correct. The large back of the head tips the chin toward the chest, folding the airway; padding restores a neutral position."
        },
        {
          "text": "Infants have weak neck muscles that need support",
          "rationale": "Muscle strength is not the reason; skull proportion is."
        },
        {
          "text": "It elevates the chest to improve breathing",
          "rationale": "The padding goes under the shoulders to level the head, not to raise the chest."
        },
        {
          "text": "It prevents the tongue from falling forward",
          "rationale": "The tongue falls backward, not forward, and the padding addresses head position, not the tongue directly."
        }
      ],
      "correct_index": 0,
      "difficulty": 2,
      "domain": "AIR",
      "verify": true,
      "verify_notes": "Confirm in AAOS 12e."
    },
    {
      "schema_version": "1.0.0",
      "id": "EMT-02-01-02-Q002",
      "concept_id": "EMT-02-01-02",
      "style": "recall",
      "stem": "The narrowest point of a young child's airway is the:",
      "options": [
        {
          "text": "Vocal cords",
          "rationale": "The vocal cords (glottic opening) are the narrowest point in an adult, not a young child."
        },
        {
          "text": "Cricoid ring",
          "rationale": "Correct. In young children the cricoid cartilage is the narrowest point, giving the airway a funnel shape."
        },
        {
          "text": "Nasopharynx",
          "rationale": "The nasal passages are small but are not the narrowest point of the airway."
        },
        {
          "text": "Carina",
          "rationale": "The carina is a branch point in the lower airway, not the narrowest part."
        }
      ],
      "correct_index": 1,
      "difficulty": 2,
      "domain": "AIR",
      "verify": true,
      "verify_notes": "Confirm in AAOS 12e."
    },
    {
      "schema_version": "1.0.0",
      "id": "EMT-02-01-02-Q003",
      "concept_id": "EMT-02-01-02",
      "style": "application",
      "stem": "Hyperextending a small child's neck during a head-tilt/chin-lift may:",
      "options": [
        {
          "text": "Improve airflow by straightening the airway",
          "rationale": "In adults, extension helps. In small children the opposite can occur."
        },
        {
          "text": "Kink the soft trachea and obstruct the airway",
          "rationale": "Correct. The pediatric trachea has little cartilage support; overextension can collapse it. Use only slight extension in children and a neutral position in infants."
        },
        {
          "text": "Have no effect on the airway",
          "rationale": "Head position has a major effect on the pediatric airway."
        },
        {
          "text": "Cause the epiglottis to seal the trachea",
          "rationale": "The epiglottis does not close in response to head extension."
        }
      ],
      "correct_index": 1,
      "difficulty": 2,
      "domain": "AIR",
      "verify": true,
      "verify_notes": "Confirm in AAOS 12e."
    },
    {
      "schema_version": "1.0.0",
      "id": "EMT-02-01-02-Q004",
      "concept_id": "EMT-02-01-02",
      "style": "application",
      "stem": "Compared with adults, children who stop breathing become hypoxic more quickly because they:",
      "options": [
        {
          "text": "Have a slower metabolic rate",
          "rationale": "Backwards. Children have a faster metabolic rate."
        },
        {
          "text": "Have a higher metabolic rate and less oxygen reserve",
          "rationale": "Correct. Children consume oxygen faster and have less stored in the lungs, so desaturation is rapid."
        },
        {
          "text": "Have larger lungs relative to body size",
          "rationale": "Pediatric lung volume relative to oxygen demand is smaller, not larger."
        },
        {
          "text": "Cannot use their diaphragm",
          "rationale": "Infants rely heavily on the diaphragm; that is not the reason for rapid hypoxia."
        }
      ],
      "correct_index": 1,
      "difficulty": 2,
      "domain": "AIR",
      "verify": true,
      "verify_notes": "Confirm in AAOS 12e."
    },
    {
      "schema_version": "1.0.0",
      "id": "EMT-02-01-03-Q001",
      "concept_id": "EMT-02-01-03",
      "style": "recall",
      "stem": "The mechanical movement of air into and out of the lungs is called:",
      "options": [
        {
          "text": "Respiration",
          "rationale": "Respiration is gas exchange, not air movement."
        },
        {
          "text": "Ventilation",
          "rationale": "Correct. Ventilation is the physical movement of air; it says nothing about whether gas exchange is occurring."
        },
        {
          "text": "Oxygenation",
          "rationale": "Oxygenation is oxygen loading onto hemoglobin and delivery to tissues."
        },
        {
          "text": "Perfusion",
          "rationale": "Perfusion is blood flow through tissues."
        }
      ],
      "correct_index": 1,
      "difficulty": 1,
      "domain": "AIR",
      "verify": true,